id,text,source,created_at
804183832073105000,Canada is on top! Best immigration choice for oppressed elites. How Much Is a Professor Worth? https://t.co/2YKQLmNGOB,Twitter Web Client,12/1/16 4:42
804179738243670000,"#WWICS facilitates you with #Business #Immigration #Visa Consultancy for countries like US, #Canada, #Europe and‰Û_ https://t.co/LN15FmZTS3",Twitter Web Client,12/1/16 4:26
804178868072366000,@JustinTrudeau I need help getting my common laws immigration finalized 6 years 3 arc two appeals they are bullying prejudice not our Canada,Twitter Web Client,12/1/16 4:22
804176527407517000,If U want 2 apply 4 the Canada Immigration Pool go 2 the following website for info. infohttps://www.immigration.ca/en/candidate-pool.html,Twitter for iPhone,12/1/16 4:13
804176369013768000,@RobinEdgar @cerguua @Prod_Liability @CdnCommLaw @UULMNJ @HUUmanistsAssoc @CdnHeritage Catholics controlled Indian immigration to Canada,Twitter Web Client,12/1/16 4:12
804176242723274000,@RobinEdgar @cerguua @Prod_Liability @CdnCommLaw @UULMNJ @HUUmanistsAssoc @CdnHeritage Catholics blocked my immigration to Canada 30 Yrs ago,Twitter Web Client,12/1/16 4:12
804169956040523000,"Le 30 novembre 2016 ‰ÛÒ Mississauga (Ontario) ‰ÛÒ Le ministre de l‰ÛªImmigration, des RÌ©fugiÌ©s et de la CitoyennetÌ©,... https://t.co/R23GlQTc03",Facebook,12/1/16 3:47
804163690178056000,"@AtlTeaPartyLove @JimBager86 we have one, in our goverment, in Canada, Iranian, lied on her immigration papers, birthday, and birthplace",Twitter for iPad,12/1/16 3:22
804163074974285000,"""The Economist:Canada is uniquely fortunate in many ways. From our stance on free trade...to our culture shaped by‰Û_ https://t.co/ei48ZyysUq",Twitter for iPhone,12/1/16 3:19
804157214822961000,Canada‰Ûªs immigration website has crashed https://t.co/m4bvKmX8FV,Tweet Old Post,12/1/16 2:56
804150720928894000,"@ArielaE8 You know, Canada is still open for immigration if you're that uncomfortable here in the USA. President Trump, 45th. Like it or not",Twitter Web Client,12/1/16 2:30
804147693815640000,Coyne: Increased immigration is good for Canada &amp; the reasons aren‰Ûªt only economic https://t.co/EEWXZpPqWk via @nationalpost #KellieLeitch,Twitter Web Client,12/1/16 2:18
804147199831486000,https://t.co/ZlIVOwdmzB #KellieLeitch In case you missed this article... or forgot how to read... immigrants are key to Canada's success,Twitter Web Client,12/1/16 2:16
804145950650404000,"Former asylum seeker turns out to be a terrorist from El Salvador, isn't immigration great ? https://t.co/MjkSm3UQ2C",Twitter Web Client,12/1/16 2:11
804142481239523000,"@Laura_Albanese As Ontario's immigration minister, please speak against MP Kellie Leitch's deplorable campaign targeting immigrants &amp; Canada",Twitter Web Client,12/1/16 1:58
804142385731145000,November 30 Express Entry Draw Invites Candidates With Provincial Nomination to Apply for Immigration to Canada https://t.co/OBCKu1bi2A,Twitter for Android,12/1/16 1:57
804141634816458000,most interesting notification message i've seen in a while. trying to renew my passport here in Canada via‰Û_ https://t.co/9klZiRMlfC,Twitter Web Client,12/1/16 1:54
804134417824366000,The latest Nexus Canada! https://t.co/S0NtCsJcmc Thanks to @emigrate_2 @canlawyer @ScarlettEsquire #immigration #canada,Paper.li,12/1/16 1:25
804132562490769000,Canada won't take her. They've got merit based immigration.  Might consider going to RacistMarxistObama's 57th Stat‰Û_ https://t.co/TcWniWHz1r,Twitter Web Client,12/1/16 1:18
804132395528007000,Immigration to Canada is extremely difficult. Send 'em to VENEZUELA! https://t.co/AmkaVFMIwR,Twitter Web Client,12/1/16 1:17
804127019390758000,Reasons in consideration of immigration adit canada: cFy https://t.co/YONS6liyul,dlvr.it,12/1/16 0:56
804122446378864000,CFN speaker Series Disability &amp; Displacement underway #Disability #immigration #Canada #Calgary https://t.co/Dls9cThbdd,Twitter for Android,12/1/16 0:38
804114404287639000,hi yes @canada i'd like to begin the immigration process to your country https://t.co/Lu2ZZ7nSMW,Twitter for Android,12/1/16 0:06
804113559122649000,The sacrificial canada immigration consultants drag delhi: ZPokpN,dlvr.it,12/1/16 0:03
804113146822664000,Hang on a sec. Isn't this anti-immigration stance racist? https://t.co/49ukpfCGhw,Tweetbot for Mac,12/1/16 0:01
804112262537629000,"we should add more specific immigration screening in the education so we can let and attract skilled workers to come into Canada#ckssgeoimm",Twitter for Android,11/30/16 23:57
804110289851580000,Immigration reforms benefit international students seeking permanent residence in Canada https://t.co/bxA8TjyzDp #study #etudier #education,Hootsuite,11/30/16 23:50
804109239610392000,"The left love to discuss Canada's health care, but never Canada's immigration policies.",Twitter for Android,11/30/16 23:45
804107460684328000,US Citizens Moving to Canada | NAFTA | Permanent Residence https://t.co/aGTjP0Acow,Twitter Web Client,11/30/16 23:38
804088641668730000,Get the latest news &amp; podcasts about immigration to Canada - Newsletter at https://t.co/FCmSqgwpFF https://t.co/N4jklcBWBD,Hootsuite,11/30/16 22:24
804082597924052000,New immigration rules make it easier for Americans to work and stay in Canada https://t.co/CHjCGojPn6 #CDNIMM,TweetDeck,11/30/16 22:00
804082352976752000,@deeperfectgem You think US immigration to Canada will be massive ?,Twitter Web Client,11/30/16 21:59
804078617470861000,What I would change about our immigration system is that we very throughly look at who we are considering to come into Canada #ckssgeoimm,Twitter for iPhone,11/30/16 21:44
804077212844498000,Canada immigration unoccupied online studying reproach: gNMuHZomj,dlvr.it,11/30/16 21:38
804074863967211000,@nitacarr It would cost too much money to go to Canada and then wait around for birth certificate and do immigration paperwork.,Twitter for Android,11/30/16 21:29
804073162019340000,New immigration rules make it easier for Americans to work and stay in Canada https://t.co/wClL5Kfub2,Twitter for Android,11/30/16 21:22
804072516645978000,"‹âÇ‹Ä_‹ÄÛ‹Å¨‹ÄÒ‹â_Œè_Œ_Ñ‹ÅÇ‹ÅÜ‹ÅÜ‹âÜè_ÈçÓ¬‹ÅÎ_Ç÷‹Åè‹Å_Œ_¡‹Å£‹Å_‹Åã‹Å_‹Å_‹âÒ‹ÅÜ•_Ù‹Ä_‹Ä_‹ÄÔ‹â_‹âÇ‹Ä_‹ÄÛ•_öYuPass Canada Immigration Inc. •_ä‹Å_‹Åø‹ÛÅ‹â_‹â_‹Äö‹âÕ__Ô‹Åö‹ÅÙè_¢‹ÅãçÓ_èÇÜ_____¥‹âÕ_èê_Áö•_Åhttps://t.co/yF1nHQbiDU https://t.co/83dA4Ze0e0",TweetDeck,11/30/16 21:20
804070228485345000,"@bethlovesbolly Also, can Canada please make it their immigration anthem. Let's go to the mall, everybody! _Ù÷Ï",Twitter for Android,11/30/16 21:10
804068780523606000,.@Sjkot is off to #yow today for the @P2PConnects ntl conference. Excited to hear thoughts on the future of #immigration in Canada! #cdnimm,Buffer,11/30/16 21:05
804067119180763000,@JustinTrudeau As an American living in Ontario and in the middle of the immigration process... THANK YOU for all the Awesomeness _ÙÕÏ Canada,Twitter for Android,11/30/16 20:58
804066140544790000,"a history of mental health treatment is grounds for being denied immigration to Canada, FYI https://t.co/ASlmKMsLit",Twitter Web Client,11/30/16 20:54
804065448975278000,"Should #Canada ban or severely reduce #immigration and #refugee migrations from poor, unstable, or war-torn areas of the world?",Twitter Web Client,11/30/16 20:51
804063945652740000,Easy answer. The US DOES NOT! allow direct immigration from Somalia. They must come by way of Canada.   https://t.co/V86E2jM7lE,Twitter for Windows,11/30/16 20:45
804063944549814000,"@KellyO @maggieNYT @NBCNews What was that Canada immigration #?  Next thing you know, Michele Bachmann will be in on things.  Oy.",TweetDeck,11/30/16 20:45
804063452214022000,"MaRS CEO Ilse Treurnicht says immigration, attracting foreign investment key to Canada‰Ûªs economic growth https://t.co/u7JX5GAfGL",LinkedIn,11/30/16 20:44
804058823958872000,Government of Canada allows Mexican nationals to apply for eTA in advance of removing visa requirements https://t.co/1XYeWODsdh #Immigration,Hootsuite,11/30/16 20:25
804057912934998000,"@MissDoozy @GregAbbott_TX Don't think you can inform me about immigration in my own country. It's harder to be accepted to Canada, trust me.",Twitter for iPhone,11/30/16 20:21
804057074959347000,@LisaToddSutton We have Dodd Frank X 10 regulations in Canada for 80 years. + our open immigration system is great for the housing markets.,Twitter Web Client,11/30/16 20:18
804056681009139000,Reasons in consideration of immigration now canada: sgmims https://t.co/jt95SCNHLa,dlvr.it,11/30/16 20:17
804055469761433000,"BREAKING: The latest #ExpressEntry draw, which just took place, is one of the most interesting ever. Find out why:‰Û_ https://t.co/L662VmJqp0",Twitter Web Client,11/30/16 20:12
804054531067809000,"Pour toute demande d'immigration lÌ©gale au Canada. Adressez vous a Legite QuÌ©bec. Pour tous informations Ì©crivez https://t.co/YHwBYwxTJb",Twitter for Android,11/30/16 20:08
804054306064306000,"Fascinating thread, close-reading of book rec for more info, &amp; has me thinking of parallel immigration dynamics in‰Û_ https://t.co/XBCzJ5PQuf",Twitter Web Client,11/30/16 20:07
804051768149676000,Immigration au CanadaåÊ: toujours possibleåÊ? https://t.co/c2EItBNh1o via @Boursorama,Twitter Web Client,11/30/16 19:57
804051457825710000,RÌ©forme de l'immigration au Canada pour les travailleurs hautement qualifiÌ©s https://t.co/XI8SaJwSLH @CitImmCanFR #cdnimm #EntrÌ©eExpress,Twitter Web Client,11/30/16 19:56
804051018417901000,Immigration reform to improve the mobility of highly-skilled workers in Canada https://t.co/UVSOgdaFXY @CitImmCanada #cdnimm #ExpressEntry,Twitter Web Client,11/30/16 19:54
804044440356593000,@JustinTrudeau To get immigration into Canada just got a lot harder to do with the recent changes with the scores to apply.,Twitter Web Client,11/30/16 19:28
804043252303331000,"My immigration process is a live example. _Ù÷Ü#CIC #ExpressEntry #Canada https://t.co/8zJpBbrih5",Twitter for iPhone,11/30/16 19:23
804043014817665000,"48th #expressentry on November 30th, 2016 559 applicants were drawn with a minimum of 786 points #lmia #immigration‰Û_ https://t.co/TTAJlwSlRF",Twitter Web Client,11/30/16 19:22
804042832499658000,#StartupChats - Developing Your Business Idea - Startup Canada https://t.co/JqjpkYn0kU https://t.co/D6xIZ89Iuy,Crowdfire App,11/30/16 19:22
804041969462898000,"@WilliamsRDan @ballj65 @mavs_bigot No, locking them up for an illegal act is legal. Both Canada and Mexico have Immigration laws too. Try it",Twitter Web Client,11/30/16 19:18
804041889339080000,"Jovinda v Canada (Immigration, Refugees, and Citizenship), 2016 FC 1297 (CanLII) https://t.co/jXbrOsCf6N #CourfÌ©dÌ©rale #justice",IFTTT,11/30/16 19:18
804041878639411000,"CHAPPELL v Canada (Citizenship and Immigration), 2016 FC 1243 (CanLII) https://t.co/r6xvXl4Ngv #CourfÌ©dÌ©rale #justice",IFTTT,11/30/16 19:18
804040775927373000,Immigration to Canada under the new modified Express Entry Program. Send your CV for initial‰Û_ https://t.co/2KgrrPYMJk,Instagram,11/30/16 19:13
804039926467756000,"Cech v Canada (Citizenship and Immigration), 2016 FC 1312 (CanLII) https://t.co/cjTGAZZsNG #CourfÌ©dÌ©rale #justice",IFTTT,11/30/16 19:10
804039924869726000,"Roshan v Canada (Citizenship and Immigration), 2016 FC 1308 (CanLII) https://t.co/Q9V7AQ9I7C #CourfÌ©dÌ©rale #justice",IFTTT,11/30/16 19:10
804039921312927000,"Bokhari v Canada (Citizenship and Immigration), 2016 FC 1306 (CanLII) https://t.co/NCigYektXd #CourfÌ©dÌ©rale #justice",IFTTT,11/30/16 19:10
804039918867595000,"Okohue v Canada (Citizenship and Immigration), 2016 FC 1305 (CanLII) https://t.co/wgbx2UERPr #CourfÌ©dÌ©rale #justice",IFTTT,11/30/16 19:10
804039287859724000,"Immigration Canada decidiÌ_ tomarse el fin de aÌ±o tranquilo y se mandÌ_ con una extracciÌ_n ""VIP""... 559... https://t.co/YCj6TJk6AY",Facebook,11/30/16 19:07
804039282251812000,#CGC1D students learning about Canada's immigration system @StPiusXOCSB https://t.co/FRUKvKpoJr,Instagram,11/30/16 19:07
804038091715407000,@JeromyYYC Happy ur parents chose Canada! So did my grandparents. How does this relate to #YYCCC? (Immigration falls under federal poli.),Twitter Web Client,11/30/16 19:03
804037676475162000,Leaning the top spot anent services self-active after canada immigration consultants gangplank hyderabad!: IfsA https://t.co/0AAetCSXjP,dlvr.it,11/30/16 19:01
804034501076779000,"@CanBorder, CBSA detains hundreds of children in immigration jails - this practice must stop! #cdnimm #cdnpoli https://t.co/x2Cro6Vyq6",Hootsuite,11/30/16 18:48
804034501072584000,"@CanBorder, CBSA detains hundreds of children in immigration jails - this practice must stop! #cdnimm #cdnpoli https://t.co/cHtHpGJCKw",Hootsuite,11/30/16 18:48
804032532916436000,Ask your Immigration Question: Calculation of Income. https://t.co/xB3pC2HnHB,Twitter Web Client,11/30/16 18:41
804032269522305000,"Immigration, Refugees and Citizenship Canada press release: https://t.co/6G75MmzHdV #Immigration #Refugees #Citizenship #Canada",Parliament Tweeter,11/30/16 18:40
804031253817257000,"@burberryant @GeeSungee Sorry...I know how to spell THEN. Guy, do you have that immigration Canada newsletter I sent you via regular email?",Twitter Web Client,11/30/16 18:36
804031253817257000,"@burberryant @GeeSungee Sorry...I know how to spell THEN. Guy, do you have that immigration Canada newsletter I sent you via regular email?",Twitter Web Client,11/30/16 18:36
804029501055193000,"The reason you don't see these Hollywood Celebs fleeing to Canada...immigration lawsand border control!",Twitter Web Client,11/30/16 18:29
804029041628024000,"I can definitely see a short term impact on brain drain from Canada, not sure on immigration back north though. https://t.co/jX32MkzP9B",LinkedIn,11/30/16 18:27
804028273349033000,Join the conversation about #immigration to #Canada on our Linkedin page: https://t.co/6OsOJd7hrJ https://t.co/6kmoDasjHU,Hootsuite,11/30/16 18:24
804025981388357000,How to Submit a New PGWP Application If You Were Previously Refused #canada #immigration https://t.co/Hd4EPEFC4V https://t.co/0QmeyrKYka,Hootsuite,11/30/16 18:15
804024978391842000,"@GeeSungee @MarchToCanada Go to an immigration attorney. If you are patient, you can TRY to go through Immigration Canada, difficult, that.",Twitter Web Client,11/30/16 18:11
804023223780253000,Just got a scary message from Immigration Canada. To tell me that my PR card is important. That one must keep it up to date.,Twitter Web Client,11/30/16 18:04
804023065105596000,"If We Build It, Will They Come?  Canada's #Immigration and the #Global #Economy  https://t.co/gwPm4NfWdG",Hootsuite,11/30/16 18:03
804022228249616000,https://t.co/x8yEjdcwzd Interesting. #canada #proud,Mobile Web (M5),11/30/16 18:00
804022189569744000,7 Jobs With Highest Fast-track Acceptance into Canada #immigration https://t.co/lb01zJGWsb via @NSAmericas,Twitter Web Client,11/30/16 18:00
804019826524090000,"@marylouise5461 Hi, this matter is the responsibility of Immigration, Refugees and Citizenship Canada https://t.co/IMhGuWS4X5. Thanks",Hootsuite,11/30/16 17:50
804018921158414000,"Canada (Citizenship and Immigration) v. Singh, 2016 FCA 300 (CanLII) https://t.co/8fiPCLqo0A #courfÌ©dÌ©rale #justice",IFTTT,11/30/16 17:47
804017182115930000,Class action lawsuit filed over failed Chinese immigrants - British Columbia - CBC News https://t.co/TcYIEkDch4,Twitter Web Client,11/30/16 17:40
804016649670160000,New immigration rules so #Americans can #work in #Canada. #recruitment @globalnews https://t.co/4eEx1QiIH6,TweetDeck,11/30/16 17:38
804016645802893000,New immigration rules so #Americans can #work in #Canada. #recruitment @globalnews https://t.co/xYsCJ2ALHz,TweetDeck,11/30/16 17:38
804013437101703000,Moving short on #SyrianRefugee crisis &amp; timely segue to our #immigration program https://t.co/TlG4NX7xhM in #Berlin! https://t.co/nOivf1kMON,Hootsuite,11/30/16 17:25
804011684142731000,Many international #students are looking at #Canada for university. Find out why | Blog https://t.co/bFB4jUN8XT  #Immigration,Twitter Web Client,11/30/16 17:18
804008913867706000,U.S. justices divided over immigration detention dispute https://t.co/F6E6zABp0b #USA #Canada,dlvr.it,11/30/16 17:07
804007612538912000,#Manitoba to revamp #Immigration programme. #Canada https://t.co/eITyH2Bvbq https://t.co/ustynnFfms,Hootsuite,11/30/16 17:02
804007604947132000,Class action lawsuit filed over failed Chinese immigrants https://t.co/3qHs45MBWu,Facebook,11/30/16 17:02
804007594734002000,Class action lawsuit filed over failed Chinese immigrants https://t.co/Y3bowRdOri,Hootsuite,11/30/16 17:02
804007383479554000,"We cannot stress enough to our clients, ALWAYS TELL THE TRUTH AND NEVER MISREPRESENT! Be careful with who you choose‰Û_https://t.co/9DHxahEb8K",LinkedIn,11/30/16 17:01
804006015435882000,"Officially official. ‰ÏÓ‰ÏÉ‰_À_Ù__no more Canada jokes, sorry buds. _ÙÔÓ‰ÏÎ‰÷ù @ Us Immigration Naturalization https://t.co/zTL3FvZ2Hl",Instagram,11/30/16 16:55
804003992866914000,"Canada detains hundreds of children for immigration violations, report finds #cdnimm https://t.co/rU4FfR8tnc",Twitter Web Client,11/30/16 16:47
804000687461990000,"@Alyssa_Milano @JustinTrudeau Then go! Go to Canada! Oh that's right you can't, their immigration laws are too strict.",Twitter for iPhone,11/30/16 16:34
804000222053629000,@realDonaldTrump @HonJohnMcCallum how to tweet like a real leader about islamic terrorism. Canada has bad immigration policies. #weakleaders,Twitter for Android,11/30/16 16:32
803998295337172000,[#WEBCONFERENCE] Comprendre les programmes d'immigration le 5 dÌ©cembre ÌÊ 13h (heure de Paris). Inscription:‰Û_ https://t.co/CMU1C9qQCM,Twitter Web Client,11/30/16 16:25
803994358290796000,Even short-term #immigrationdetention has a long-lasting negative impact on #children https://t.co/4XPzKCzJ6m #cdnimm #cdnrfg,Twitter for iPhone,11/30/16 16:09
803992525052575000,"@KyraSpears It's cute that they think #Canada wants them. One of the toughest immigration law countries. ""Traitor brat"" not relevant.",Twitter Web Client,11/30/16 16:02
803992461953695000,What changes to Canada's Express Entry immigration system mean for you: https://t.co/LmC8Vuuthg,Hootsuite,11/30/16 16:01
803992355934244000,Mon dossier est traitÌ© depuis 6 mois ÌÊ Canada Immigration mais je ne reÌ_ois pas mon visa de RP car il y a des quotas!!,Mobile Web (M5),11/30/16 16:01
803987215479140000,New immigration rules make it easier for Americans to work and stay in #Canada: https://t.co/9cSEFwggOB #immigration,Hootsuite,11/30/16 15:41
803987215479095000,New immigration rules make it easier for Americans to work and stay in #Canada: https://t.co/8xTxeEiob2 #immigration,Hootsuite,11/30/16 15:41
803985571341275000,What the Changes to Canada‰Ûªs Express Entry Immigration System Mean for You - https://t.co/IpVSdZimo1,Facebook,11/30/16 15:34
803985421139083000,ôö¯_ô_¯á ¯£ôö ôÉ¯_¯_ôÉô_ ¯_ôãôà¯Â¯±¯© ¯_ôãôä ôÄô ¯ø¯_ (ôÄôã ôÉ¯_ ô_¯Âô_ ¯_ôãô_ôÄ ôÉ¯_¯±ôÅ¯»ôà ôâ¯¬ôã ¯£ô  ¯»ôè¯¨¯ø¯_) intermÌ©diaires en immigration https://t.co/YDAyS2x6aS,Facebook,11/30/16 15:33
803980766992400000,"@Lrihendry @DclareDiane Like I said, he should have stuck to boxing. Canada USED to have very strict immigration laws. Steer them to #Syria",Twitter Web Client,11/30/16 15:15
803979070170079000,"#NB: ""#WilmotHouse remains first stop for #newcomers to #Fredericton"" @CBCNB https://t.co/aYLlrhzmT1 #Immigration #multicultural #welcome",Twitter Web Client,11/30/16 15:08
803978376797097000,Now more than ever we should try to learn from one of few high immigration countries that does not have strong radi‰Û_ https://t.co/eLrP8W0fzs,Twitter Web Client,11/30/16 15:05
803977305148289000,"@althered68 @KelemenCari @artist35 @JackPosobiec Does Canada have the same plan on immigration as Joe Biden?https://t.co/XC6IorihAP",Twitter for Android,11/30/16 15:01
803977190748647000,"Canada is going to Increase Immigration Quotashttps://t.co/3fP9bIWuBx https://t.co/yer3k2wRv8",Twitter Web Client,11/30/16 15:01
803975677502328000,"Discussing the scourge of ""ghost consultants"" on @1067REDFM with host @RishiKNagar at 10 this morning: https://t.co/mYRJ9sh2ea",Twitter Web Client,11/30/16 14:55
803974580553547000,@GatorsEite23 @TheDemocrats I think they're mad that Canada's immigration server didn't even want them and their leader is still bitching.,Twitter Web Client,11/30/16 14:50
803973488188989000,"@patricionavia @DeliaDG se hace esto en Chile? Claramente, no! https://t.co/xQU9kPArl5",Twitter for iPhone,11/30/16 14:46
803972974588084000,"""Resettling Child Refugees: Canada and Armenian Orphans, 1923-1927"" Canadian Museum of Immigration at Pier 21 https://t.co/PAaKAlUQ8I",Facebook,11/30/16 14:44
803971681656205000,"On #Canada #Visa application: Clients of convicted immigration consultant facing deportation for lying https://t.co/9PCSaWOkqW",Facebook,11/30/16 14:39
803971649720741000,Want to immigrate to #Canada? Fill out our free online assessment form to learn more about your options:‰Û_ https://t.co/AjldLESU4i,Twitter Web Client,11/30/16 14:39
803970650884939000,Savez-vous ÌÊ propos de l'Autorisation de voyage Ì©lectronique? Elle est nÌ©cessaire pour certains visiteurs au Canada. https://t.co/8azZW9qrzF,Twitter Web Client,11/30/16 14:35
803969627869085000,Big changes to #ExpressEntry syatem for residency applicants in #Canada. See details here: https://t.co/uehDxdM7Ok‰Û_ https://t.co/3UAn6rYmay,Twitter Web Client,11/30/16 14:31
803969094106152000,Canada Should Be Trump's Model for Immigration Reform https://t.co/DNmrRpCDnI,Buffer,11/30/16 14:29
803964779287166000,"¯_ôãôà¯Â¯±¯© ¯_ôãôä ôÄô ¯ø¯_ ôÅô_ 6 ¯£¯«ôà¯±¯_ô  ¯á¯±ô_ôâ ô ¯ü¯_ôÉ ¯_ôã¯ø¯¨ôöôã ¯_ôã¯_¯±ô_¯_ express entry ................................¯«¯_¯±ôÄ ¯_ôãôÉôö¯_ôö¯_... https://t.co/IxLN1k0pl1",Twitter for iPhone,11/30/16 14:11
803963363264987000,@ObservatorioDmc en cualquier parte para inmigrar te exigen 1 montÌ_n de requisitos poner otros adjetivos es absurdo. https://t.co/xQU9kPArl5,Twitter for iPhone,11/30/16 14:06
803961567960252000,Express Entry Canada - A New Life awaits https://t.co/HkmsOb9iDt https://t.co/8ZpTqnlqqq,Spokal,11/30/16 13:59
803960527416336000,"Ever heard of the Electronic Travel Authorization (eTA)? It's a new requirement for some visitors to Canada. https://t.co/vdiBUf4XHs",TweetDeck,11/30/16 13:55
803958010850775000,"Working Holiday Visa Canada - Holiday, Study &amp; Get Paid https://t.co/wvg9T360Uk https://t.co/VsJtu9b567",Spokal,11/30/16 13:45
803955436793671000,"Infographic: How open immigration policies contribute to Canada's economic successhttps://t.co/F2XuuXCnS3‰Û_ https://t.co/HXy5RVPnNv",Twitter for iPad,11/30/16 13:34
803954522779451000,"@Gonshalo estÌÁ bien, y cÌ_mo se evalÌ_a eso? Que requisitos deben tener? AquÌ_ un ej de polÌ_tica en Canada... https://t.co/xQU9kPArl5",Twitter for iPhone,11/30/16 13:31
803946139334701000,Points per Factor Express Entry Points Summary https://t.co/FFW4Kx4711 https://t.co/qPt9DW9VUc,Spokal,11/30/16 12:57
803942569440935000,Why #Tech Founders choose #Canada over #SiliconValley: https://t.co/0E03uy9hQR #StartupVisa #Startup #Immigration,Twitter for Android,11/30/16 12:43
803942078682165000,Canada's immigration policies play a big part in its economic success. https://t.co/oECWeS7LKE via @TheEconomist,Hootsuite,11/30/16 12:41
803939961061969000,@petefrt @CR adopt Canada's immigration criteria.,Twitter for Android,11/30/16 12:33
803924822329692000,@IvanOlguin aca te dejo Requistos Inmigrantes para Canada. https://t.co/BCfjDa7dwe trata de quedarte un dia sin reg‰Û_ https://t.co/PXD1SPyLr9,Mobile Web (M5),11/30/16 11:33
803924034874314000,Class action lawsuit filed over failed Chinese immigrants https://t.co/96UtcHoez8 #CDNIMM,TweetDeck,11/30/16 11:30
803908783978283000,@junaidnaeemir @MJibranNasir To them it didnt matter whether it was a court in Germany or an immigration ceremony in Canada,Twitter for Android,11/30/16 10:29
803904933078528000,"Dogmatic Pro-immigration folks in US, Canada, and Australia are very pragmatic.",Twitter Web Client,11/30/16 10:14
803902425128173000,#Ontario : #recrutement des #immigrants #francophones https://t.co/ma7oxQhaGo https://t.co/g3EKYjI375,HubSpot,11/30/16 10:04
803901087174578000,"Devolving immigration powers to Scotland makes sense, given its demographic time-bomb (MPs are arguing today). Precedent with Canada/Quebec.",Twitter Web Client,11/30/16 9:58
803896729489637000,@ANOMALY1 #canada doesn't want them and has some pretty tough immigration laws - try #Syria since they love open borders and you know...,Twitter Web Client,11/30/16 9:41
803895573527072000,"Info session abt Immigration in Canada Express Entry, on Dec. 15, at 6:00 PM at CRRAE-UMOA in Abidjan. To register: https://t.co/uTPjVJcmER",Twitter Web Client,11/30/16 9:36
803894888135729000,Canada immigration untaxed online plugging advice: UMQ https://t.co/s4z4e9DTHr,dlvr.it,11/30/16 9:34
803893818932260000,"#Immigration #Overseas #Clients #Reviews, #Visa For #Canada &amp; #Australia Visit Here... https://t.co/W3EruTEmiK https://t.co/fkhUIiSqqa",Twitter Web Client,11/30/16 9:29
803892716841082000,Session d'info Immigration au Canada EntrÌ©e Express 15 dÌ©c.ÌÊ 18h au CRRAE-UMOA ÌÊ Abidjan. Pour s'inscrire https://t.co/vDkTeKOznU ‰Û_,Twitter Web Client,11/30/16 9:25
