id,text,source,created_at
805198542591717000,@OurbabyMinx @WildWhiskeyRant killed and tried to go to Canada illegally and see what there immigration policy is. You don't have a cont.,Twitter for iPhone,12/3/16 23:54
805194503892176000,https://t.co/t1ggH7wnFk,Twitter for Android,12/3/16 23:38
805191397666131000,L‰Ûªimmigration irrÌ©guliÌ¬re au Canada dÌ©cortiquÌ©e en 5åÊquestions https://t.co/SfAdfzTfb7,Facebook,12/3/16 23:26
805189879424581000,Reminds me of Liberal Immigration Fraudster Monsef avoiding deportation from Canada. #cdnpoli #LPC #CPCLDR‰Û_ https://t.co/ZOZOSe1CqQ,Twitter for iPhone,12/3/16 23:20
805187745207480000,#immigration #integration #canada https://t.co/M5cKGyvV8F,Facebook,12/3/16 23:11
805181416778543000,We want controlled immigration that contributes positively to the UK economy. Same as Australia &amp; Canada. https://t.co/99mYliuOes,Tweetbot for iëÙS,12/3/16 22:46
805177069600731000,Is the new Manitoba immigration fee a head tax? https://t.co/LsG7C3vLe9,Facebook,12/3/16 22:29
805176811873144000,Canada immigration profit influence modernistic delhi yet abhinav: XKofy https://t.co/becgusY2i6,dlvr.it,12/3/16 22:28
805176384708575000,Canada Immigration Minister to ‰ÛÏSubstantially Increase  Immigration Numbers https://t.co/nEFw30MRaa https://t.co/cyI867PZRV,Spokal,12/3/16 22:26
805172274999554000,MÌ»me les #USA=pays d'immigration par excellence CONTRÌÓLE RIGOUREUSEMENT l'immigration et accÌ¬s ÌÊ la #GreenCARD!‰Û_ https://t.co/IHpVhW2BaG,Twitter Web Client,12/3/16 22:10
805171691315818000,@Shawhelp what changes should be made to Canada's immigration laws due to the influx of immigration and violence?,Twitter for Android,12/3/16 22:07
805167260843151000,L‰Ûªimmigration irrÌ©guliÌ¬re au Canada dÌ©cortiquÌ©e en 5 questions https://t.co/f4utO5A7ZF,newsquebec.ca,12/3/16 21:50
805164501809041000,L'immigration irrÌ©guliÌ¬re au Canada dÌ©cortiquÌ©e en 5 questions - https://t.co/UiBsEZOqas https://t.co/j77dEvjoiX https://t.co/XXDeIG7Dbu,dlvr.it,12/3/16 21:39
805164015559315000,Will Media ask the Liberals if they actually have a solid plan for Canada _Ùà¬_Ùà_?? From my view -- immigration out of C‰Û_ https://t.co/YAgwmZ8ECp,Twitter for iPhone,12/3/16 21:37
805161770260131000,Dan Murray ofåÊImmigration Watch Canada is xenophobic racist fear-mongering liar #racism #canada #cdnpoli #hatecrime‰Û_ https://t.co/kwZ3csvYxM,Twitter for Android,12/3/16 21:28
805158402271969000,Le Canada lance une vaste campagne d'immigration pour faire face ÌÊ son besoin de main d'ÅÒuvre https://t.co/kXdfMGTZzN,Twitter for iPhone,12/3/16 21:14
805158302749523000,L‰Ûª#immigration irrÌ©guliÌ¬re au #Canada dÌ©cortiquÌ©e en 5åÊquestions https://t.co/s3hu1OKKIG,Twitter Web Client,12/3/16 21:14
805158164433924000,@Canadidly I've read the Immigration laws of Canada much stricter than the US,Twitter for iPhone,12/3/16 21:14
805152723360477000,"Canada Immigration Website Traffic Surges And Crashes In Wake Of Trump #fasttraffic,#sitetraffic,#website,#traffic https://t.co/zRlJ26jnkC",SocialCloudSuite,12/3/16 20:52
805149160294862000,Mr Know-all of Canada Immigration https://t.co/wTQK4QDiKI,Twitter for iPhone,12/3/16 20:38
805145129287876000,"Move to Canada @LadyMadonna___ Oh, immigration rules, you can't... https://t.co/5LIEVHO7A4",Twitter for iPad,12/3/16 20:22
805140858290978000,#OnThisDay Annette Toft becomes Canada's 2 millionth immigrant since 1945. Do you know your family's immigration st‰Û_ https://t.co/UvRuw8eR1b,Hootsuite,12/3/16 20:05
805139440842772000,"Le #Canada acceptera 300.000 #migrants en 2017https://t.co/rc2jHm09Xf https://t.co/mjsWj1dTTDLes mÌ»mes traÌ¨tres sont au pouvoir partout",Twitter for BlackBerry,12/3/16 19:59
805134944792145000,Immigration Developments From The Fall Economic Statement - Immigration - Canada https://t.co/5kzBy61DK1,Hootsuite,12/3/16 19:41
805134910059114000,Immigration Developments From The Fall Economic Statement - Immigration - Canada https://t.co/vMx1eb92eq,Hootsuite,12/3/16 19:41
805134910054862000,Immigration Developments From The Fall Economic Statement - Immigration - Canada https://t.co/3W4fbJHRx3,Hootsuite,12/3/16 19:41
805134909794816000,Immigration Developments From The Fall Economic Statement - Immigration - Canada https://t.co/1SY5p6D7xi,Hootsuite,12/3/16 19:41
805134909782261000,Immigration Developments From The Fall Economic Statement - Immigration - Canada https://t.co/DNe7Uwcmvs,Hootsuite,12/3/16 19:41
805134549352992000,Canada immigration in the clear online ace bandage tutelage: rgxBiaX https://t.co/K0bWZ0SMvc,dlvr.it,12/3/16 19:40
805134326702768000,Immigration Developments From The Fall Economic Statement - Immigration - Canada https://t.co/mr30IhASly,Hootsuite,12/3/16 19:39
805134326572589000,Immigration Developments From The Fall Economic Statement - Immigration - Canada https://t.co/5kzBy6jeBz,Hootsuite,12/3/16 19:39
805134326455222000,Immigration Developments From The Fall Economic Statement - Immigration - Canada https://t.co/6PIblRwcz7,Hootsuite,12/3/16 19:39
805134326362935000,Immigration Developments From The Fall Economic Statement - Immigration - Canada https://t.co/k7WCURXvhw,Hootsuite,12/3/16 19:39
805133838645153000,I had applied for skilled immigration for Australia and Canada through Premiers international Dubai. Both my applications were rejected.,Twitter for Android,12/3/16 19:37
805131251254317000,"Hundreds may lose Canadian citizenship, resident status because of one corrupt immigration consultant https://t.co/L4tkinUP1r",Facebook,12/3/16 19:27
805130739847020000,I wouldn't. I'd offer a shift toward a Canada-style points-based immigration system as the solution to his concerns. https://t.co/wFMbf57SdR,Twitter Web Client,12/3/16 19:25
805127140303863000,Immigration Canada: Suicide Via Self-Congratulatory ALTRUISM. https://t.co/5juFbv19FA,Twitter Web Client,12/3/16 19:10
805126198997159000,Canada's immigration website crashes on election night https://t.co/98IPx2P2IH,Twitter Web Client,12/3/16 19:06
805125975646212000,https://t.co/hIc61sp8R4... https://t.co/C6gxVNJD1j,Facebook,12/3/16 19:06
805123261952573000,Good; and this will probably will increase intl student applications given the state of US right now https://t.co/xpxzjDLz1r via @cdnbiz,Twitter Web Client,12/3/16 18:55
805119786229387000,"Canada is blessed for being a peacemaker:Blessed are the peacemakers: for they will be called children of God.https://t.co/2jBd91Zq2q",Twitter Web Client,12/3/16 18:41
805118411659497000,@montesolberg Now add the fact she should not be in parliment or Canada. She entered Canada illegally by falsifying immigration papers,Twitter for Android,12/3/16 18:36
805117878332690000,@leilaakais l immigration au Canada est un bizness comme le pÌ©trole ou le bois,Twitter for iPhone,12/3/16 18:33
805116079018217000,@Paola_Dec1231 @MaryamMonsef @HuffPostCanada Deport the lying Immigration fraudster scumbag. She betrayed Canada &amp;‰Û_ https://t.co/ACQERuDiS5,Twitter for iPhone,12/3/16 18:26
805115921962594000,L‰Ûªimmigration irrÌ©guliÌ¬re au Canada dÌ©cortiquÌ©e en 5 questions https://t.co/Bwwg0RojeK,IFTTT,12/3/16 18:26
805113155907190000,L‰Ûªimmigration irrÌ©guliÌ¬re au Canada dÌ©cortiquÌ©e en 5åÊquestions https://t.co/w8ehCFu1Hj,Twitter for Android,12/3/16 18:15
805112005489094000,L‰Ûªimmigration irrÌ©guliÌ¬re au Canada dÌ©cortiquÌ©e en 5 questions https://t.co/JMaAMd0TKf,dlvr.it,12/3/16 18:10
805112002288848000,L‰Ûªimmigration irrÌ©guliÌ¬re au Canada dÌ©cortiquÌ©e en 5 questions https://t.co/zAWAefQenE,dlvr.it,12/3/16 18:10
805110457090576000,L‰Ûªimmigration irrÌ©guliÌ¬re au Canada dÌ©cortiquÌ©e en 5 questions https://t.co/Bwwg0RojeK #src #nouvelles,IFTTT,12/3/16 18:04
805110090525188000,Mexican visa lift kicking in today expected to cost Canada $262M over a decade https://t.co/LTmuTJ4tbc,Facebook,12/3/16 18:02
805109030914052000,.@TheEconomist profiles Canada's open immigration policies &amp; how they contribute to our economic success:‰Û_ https://t.co/cudkuxCaQV,PostBeyond,12/3/16 17:58
805107323786162000,Canada Immigration  ˆ_Âˆ_Àˆ_áˆ_øˆ__ˆ_à ˆ_øˆ_à ˆ_¥ˆ_Üˆ_¬ ˆ_ ˆ_»ˆ_Áˆ_àˆ_Ù ˆ_»ˆ_àˆ__ˆ_à ˆ__ˆ_Üˆ__ ˆ_¡ˆ__ˆ__ˆ_Åˆ_¬ ˆ_ ˆ_¨ˆ__ˆ__ˆ_àˆ_¡ ˆ_»ˆ_àˆ_Ïˆ_à......... https://t.co/t8KLDG3IRS,Facebook,12/3/16 17:51
805107095091679000,New plan: bribe Canadian immigration with 1000 bottles of Canada Dry.,Twitter for iPhone,12/3/16 17:51
805101870264029000,.@TheEconomist profiles Canada's open immigration policies &amp; how they contribute to our economic success:‰Û_ https://t.co/4K84EE8Y63,PostBeyond,12/3/16 17:30
805101086247886000,"Hundreds may lose Canadian citizenship, resident status because of one corrupt immigration consultant https://t.co/x2IfO0EXI2",Hootsuite,12/3/16 17:27
805095645375696000,Immigration for canada without india: an compassionate handle: deyFy,dlvr.it,12/3/16 17:05
805092456710701000,"#Jamaican #immigrants #Canadahttps://t.co/vcmfYGadR5#statistics #immigration",Twitter Web Client,12/3/16 16:52
805091888160186000,Mexican visa lift expected to cost Canada $262M over a decade https://t.co/9i72fRhtij,Hootsuite,12/3/16 16:50
805091577349734000,"Are people still moving to #Canada ??? Oh that's right, they have real immigration laws and it's‰Û_ https://t.co/0C5OBfmxLG",Instagram,12/3/16 16:49
805089130136772000,"Here are more details on the Richmond, B.C. Immigration Consultant Sunny Wang who was sentenced to 7 years in... https://t.co/YXH5W53srO",Facebook,12/3/16 16:39
805080937172205000,I added a video to a @YouTube playlist https://t.co/CnEyWN40x3 Funny Talking of Haryanavi Jat with Canada Immigration Girl Agent,Google,12/3/16 16:07
805080451912232000,Mexicans Can Now Travel Visa-Free To Canada https://t.co/Ec3XHORO2s https://t.co/RQRr5nebcG,Hootsuite,12/3/16 16:05
805078095036289000,L‰Ûªimmigration irrÌ©guliÌ¬re au Canada dÌ©cortiquÌ©e en 5åÊquestions https://t.co/DkpuKyWmaK,Twitter Web Client,12/3/16 15:55
805077774021042000,"@SweetnessShawnB Hes the POS that ramped up immigration for Canada, among other globalist policies.",Twitter for Android,12/3/16 15:54
805075724776378000,"Canada lifted visa requirements to Mexico as of Dec 1, 2016. Thoughts? #visa #immigration",Hootsuite,12/3/16 15:46
805070573072216000,@HuffingtonPost people Keep praising Canada and Canada has way stricter immigration laws then us they willl boot your liberal American ass,Twitter for iPhone,12/3/16 15:25
805070049329446000,Google search trends for _Ùà¬_Ùà_ Canada immigration. https://t.co/BQp4woz9ih,Twitter for iPhone,12/3/16 15:23
805069931066851000,Canada Immigration Language Converter https://t.co/4gfDPkRA4R,Facebook,12/3/16 15:23
805068829567152000,L‰Ûªimmigration irrÌ©guliÌ¬re au Canada dÌ©cortiquÌ©e en 5 questions https://t.co/p52HowlB0l https://t.co/SsXhh819b3,TweetDeck,12/3/16 15:19
805068828774273000,L‰Ûªimmigration irrÌ©guliÌ¬re au Canada dÌ©cortiquÌ©e en 5 questions https://t.co/PwKOejcRb9 https://t.co/eKStrC9FWQ,TweetDeck,12/3/16 15:19
805068828191457000,L‰Ûªimmigration irrÌ©guliÌ¬re au Canada dÌ©cortiquÌ©e en 5 questions https://t.co/6vSeYVDd39 https://t.co/xERK5s4k0j,TweetDeck,12/3/16 15:19
805066891723177000,I predicted the mass illegal immigration to #canada after #Trump https://t.co/XTyOj10QBM,Twitter for Android,12/3/16 15:11
805062853233438000,How to Submit a New PGWP Application If You Were Previously Refused #canada #immigration https://t.co/Hd4EPEFC4V https://t.co/eHzn8LT5EC,Hootsuite,12/3/16 14:55
805059014274981000,New immigration rules so #Americans can #work in #Canada. #recruitment @globalnews https://t.co/xYsCJ2jaQ1,TweetDeck,12/3/16 14:40
805059013134008000,New immigration rules so #Americans can #work in #Canada. #recruitment @globalnews https://t.co/4eEx1QAjyE,TweetDeck,12/3/16 14:40
805055760292073000,Huge immigration fraud scandal in BC https://t.co/H4xYqr5oH3,Facebook,12/3/16 14:27
805054097607028000,"Hundreds may lose Canadian citizenship, resident status because of one corrupt immigration consultant https://t.co/8wT8b6Bkz5",Twitter for iPhone,12/3/16 14:20
805051366716637000,"Doing ""time""https://t.co/xbZD4n6OXF",Twitter for iPhone,12/3/16 14:09
805049332386983000,"Hundreds may lose Canadian citizenship, resident status because of  corrupt immigration consultant https://t.co/CpPWDxWrwe via @nationalpost",Put your button on any page! ,12/3/16 14:01
805049266842566000,Canadian immigration officials turning to German colleagues for advice on bringing Yazidi refugees to Canada #cdnrfg https://t.co/Z58cPmjoa1,Hootsuite,12/3/16 14:01
805041628570415000,https://t.co/OcRaYP0ZlP,Twitter for Android,12/3/16 13:30
805039938248970000,"Trudeau real agenda, 1. Erode the sovereignty of Canada.2. Create and reinforce division in Canada.3. Open Canada to massive immigration.",Twitter Web Client,12/3/16 13:24
805035860492251000,"""Currently, migrant workers account for 12% of Canada‰Ûªs agricultural workforce"" https://t.co/s0tBtRvXYx #cdnimm",Twitter for iPhone,12/3/16 13:08
805035390516297000,Should Canada be doing this? Comment below why or why not! #education #immigration #Canada #university‰Û_ https://t.co/qXNYwTBOeI,Fan Page Robot,12/3/16 13:06
805026559006425000,"let's be clear, the united states, australia, canada were not built on immigrationthey were colonies, bringing new laws, arts, equipment",Twitter Web Client,12/3/16 12:31
805013988912283000,"Hahahahaha! In the year 2074, Canada is building a wall to stop illegal immigration from the US! _Ù_£_Ù_£_Ù_£I love it already!",Twitter for iPad,12/3/16 11:41
805010610761109000,Hundreds may lose Cdn citizenship &amp; PRt status cuz of 1 corrupt immigration consultant. #misrep https://t.co/qTxY8ejuLN via @nationalpost,Twitter Web Client,12/3/16 11:27
805010221693222000,#Canada #Immigration Application Process with Waiting Times https://t.co/Z1L1SRaQNq,Twitter Web Client,12/3/16 11:26
805008464556605000,Canada immigration dislodge online operation the scoop: FDSj https://t.co/VmGecAM1Fi,dlvr.it,12/3/16 11:19
805007792817876000,"@HughBinks @BasimaFaysal I'm from Canada, Muslim immigration is a burden onto Canada, and unwelcome.",Twitter Web Client,12/3/16 11:16
805006820825858000,"Canada Immigration Consultancy Services.See Client Testimonial https://t.co/DVPikVYZGfCall 011-47020729,... https://t.co/JMsKkt70wh",Facebook,12/3/16 11:12
805005852235231000,Canada Immigration Seminar by Rhonda WilliamsåÊRCIC https://t.co/zHKWlQT9dq https://t.co/kKGpDqxGrt,WordPress.com,12/3/16 11:08
805003943830896000,"""How Easy or Difficult it is to get #Citizenship_in_Canada?"" https://t.co/gbpSoCNEK4 by @visasavenue on @LinkedIn",Twitter Web Client,12/3/16 11:01
805003695112982000,Canada is bracing for a surge of Mexican immigrants after Trump's win https://t.co/vWKIcVUfUw https://t.co/JRbBPTiDyP,Buffer,12/3/16 11:00
805003184599089000,Immigration to Canada has now been made easier through the Express Entry Program! Read more:‰Û_ https://t.co/X8F7sjRB58,Twitter Web Client,12/3/16 10:58
805002555508002000,Funny Talking of Haryanavi Jat with Canada Immigration Girl Agent (Hindi) (1080p HD): https://t.co/CnEyWN40x3 via @YouTube,Google,12/3/16 10:55
804997381930545000,"@grahameduncan Times up I've Daddy duty today. I'll say Canada immigration, believe Kieran rang your bell. Still waiting if his facts. _Ù÷ä_ÙÔç",Twitter for Android,12/3/16 10:35
804983384057532000,Mexican visa lift kicking in today expected to cost Canada $262M over a decade https://t.co/Db5FTkxp1k,Twitter Web Client,12/3/16 9:39
804976335357673000,#Didyoumiss via @Fb_loaded Canada immigration website crashes as Donald Trump's votes rise https://t.co/DrbJCnlQSp,Tweet Old Post,12/3/16 9:11
804972730122665000,Canada Registration Authority Immigration Advisors https://t.co/5EYvLjCfiY https://t.co/8lNtWXdHCD,Spokal,12/3/16 8:57
804972730122665000,Canada Registration Authority Immigration Advisors https://t.co/5EYvLjCfiY https://t.co/8lNtWXdHCD,Spokal,12/3/16 8:57
804963313545256000,"Hundreds may lose Canadian citizenship, resident status because of one corrupt immigration consultant https://t.co/dj4vkK4yP5 @nationalpost",Twitter Web Client,12/3/16 8:19
804960172288327000,"Avail quick and transparent process for immigration to Canadahttps://t.co/1OOnEycfSl#ImmigrationVisa https://t.co/b86T7pydZ7",Twitter Web Client,12/3/16 8:07
804954651674214000,#immigration #Francophone au #Canada #EntreeExpress #ExpressEntry #visa https://t.co/JDmi6EznhR,Twitter for Android,12/3/16 7:45
804951516582973000,Une rÌ©ussite #Francophone en #ontario #PME #immigration #Canada https://t.co/2M4AoARkHR,Twitter for Android,12/3/16 7:32
804950105350696000,#CanadÌÁ Stephen Hawking says technology will devastate the middle class - CNET https://t.co/R7rmWwV8gR,IFTTT,12/3/16 7:27
804949780447301000,#immigration #francophone en Nouvelle-Ecosse #NovaScotia #ExpressEntry #visa https://t.co/hhX4jm9a3g,Twitter for Android,12/3/16 7:25
804948038523437000,Best Trick to get Canada Visa approval in 2 days! https://t.co/nl7jb6pxy4 https://t.co/quVvubUtET,Spokal,12/3/16 7:19
804946874629111000,#Labour crisis looms in #Canada‰Ûªs agricultural sector #ForeignWorkers | Toronto Star https://t.co/276wekTDlA,Twitter for BlackBerry,12/3/16 7:14
804943244043939000,Or think Canada should bow down to them. Canada isn't changing for you sorry. #Immigration #rant #Canada,Twitter for iPhone,12/3/16 6:59
804940124857503000,Canada Immigration &amp; Visas - iam (immigration and migration) https://t.co/NqX7wmxvzZ https://t.co/gFY81RwU0B,Spokal,12/3/16 6:47
804934828873367000,Khas Mulaqaat With John McCallum  Minister Of Immigration Refugess &amp; Citizenship Canada... https://t.co/nfIP9iNllg,Facebook,12/3/16 6:26
804931024496885000,#Immigration #Consultant #Visa #Services For #Australia &amp; #Canada Visit Here..https://t.co/RIuVk5wDKb https://t.co/EPkBf9dBJF,Twitter Web Client,12/3/16 6:11
804925146855182000,"""Canada Immigration Categories &amp; News - Take A Look!"" https://t.co/99WLM0fiwM by @AnilkAbhinav on @LinkedIn",Twitter Web Client,12/3/16 5:48
804924649830313000,Recent immigrant to Manitoba says $500 fee is a 'head tax' https://t.co/uDFlWQkint,Twitter for iPhone,12/3/16 5:46
804924149906993000,@annemcelvoy @DouglasKMurray @brookeunger @j_tepperman sheer numbers make it silly to compare Germany to Canada with regard to immigration.,Tweetbot for iëÙS,12/3/16 5:44
804922066331955000,Canada &amp; Australia Immigration Apply with us https://t.co/LQWYtUXKrB,Facebook,12/3/16 5:35
804914826430423000,I just published ‰ÛÏIndia‰Ûªs Best Immigration Consultant Camrose Canada 2016‰Ûù https://t.co/cRUiOtW44m,Twitter Web Client,12/3/16 5:07
804909741520683000,November 30 Express Entry Draw Invites Candidates With Provincial Nomination to Apply for Immigration to Canada.... https://t.co/7F9Y6LiCVG,Facebook,12/3/16 4:46
804906786276933000,"Hundreds may lose Canadian citizenship, resident status because of one corrupt immigration consultant https://t.co/DDYqcUNOeM",Twitter for iPhone,12/3/16 4:35
804903246972256000,@pmgjones @stephen_taylor ...have a sneaking suspicion she won't be a resident of Canada if Immigration dep't grows a pair,Twitter for iPhone,12/3/16 4:21
804899742601924000,Canada to lift visa requirements for Mexican citizens. Expected to cost Canada more than $ 262 Million over 10 yrs https://t.co/fjwsvsNEqx,Twitter Web Client,12/3/16 4:07
804898526085922000,#CanadÌÁ Stephen Hawking says technology will devastate the middle class - CNET https://t.co/fH0Q8HV3OO,IFTTT,12/3/16 4:02
804896972108771000,Immigration to Canada https://t.co/q3kXCmTc99,Facebook,12/3/16 3:56
804896463096410000,Way on make so admirable immigration services unto canada: CDOIj https://t.co/fJPfkslwFd,dlvr.it,12/3/16 3:54
804896386185474000,Canada passport differently immigration: extenuating occupations pro matriarchic practical craftsman: PvDKzZFK https://t.co/bSfhYHTjBq,dlvr.it,12/3/16 3:53
804887867533033000,"How your ""immigration"" law pertains to one race.  A point I could understand as to a wall, Canada is even bigger than Mexico?",Mobile Web (M5),12/3/16 3:19
804887667259285000,If only #Canada had laws pertaining to #immigration and--Apparently we do have laws for just that thing--So what's‰Û_ https://t.co/X7mPmYGiga,Twitter Web Client,12/3/16 3:19
804884200436314000,I was happy to provide context and clarification on immigration matters #immfr #immigration #ExpressEntry‰Û_ https://t.co/w0d7wtqB8n,Twitter Web Client,12/3/16 3:05
804878116527214000,"@DynastyDriven @Berniecrats2020 Canada has immigration laws, have to have $$ in bank n be able to support self he should try Mexico",Twitter Web Client,12/3/16 2:41
804878094175588000,Canada immigration 2013 pedagogics: JjgWQRp https://t.co/qG5SDEfFQC,dlvr.it,12/3/16 2:41
804875224999022000,"Donald #Trump, Populism, And What It Means For #Canada  #immigration #kanimmigration https://t.co/ezRatJJUHc",Twitter Web Client,12/3/16 2:29
804874561560846000,"#Canada prepares for surge of #Mexican #immigrants after visa lift and #Trump win#kanimmigration #immigrationhttps://t.co/ungn8Myl2l",Twitter Web Client,12/3/16 2:27
804868645486784000,"@stacey_toole @gbongiovanni9 @nytimes BTW, hasnt Canada become a bit stricter nowadays with immigration",Twitter for iPhone,12/3/16 2:03
804867963325214000,"French PM visits Justin Trudeau to discuss CanadaÌ¥s trade plans, #immigration policy. #cdnpoli https://t.co/HOTlzHAQVr",Hootsuite,12/3/16 2:00
804866670783266000,"""#Canada has no limit for how long to keep someone in immigration detention. 60% in #Ontario""-Hector Almendrades @nooneisillegal #MPletstalk",Twitter for iPhone,12/3/16 1:55
804863374496559000,#CanadÌÁ Stephen Hawking says technology will devastate the middle class - CNET https://t.co/SVtBRoNmdN,IFTTT,12/3/16 1:42
804861605683036000,"via @AlexPoucher_com &amp; TheYoungTurks - Fleeing Americans Crash Canada's Immigration Sitehttps://t.co/Z78wqrbi3Q",AlexPoucher.com AutoShareFromWP,12/3/16 1:35
804860530171199000,"Check out CNN Money featuring immigration.ca as an authority on #moving to #Canada from the #USAhttps://t.co/mGjWyrJUyS",Twitter for iPhone,12/3/16 1:31
804860275589517000,"So many developments last month! Read our insights:https://t.co/YJza6dCq1r#canada #Immigration",Twitter for iPhone,12/3/16 1:30
804859187339677000,The latest Nexus Canada! https://t.co/jVbpoLxNwM Thanks to @DLBiller @MCISLanguages @mustaq_abhinav #immigration #canada,Paper.li,12/3/16 1:25
804855460842983000,Mexican visa lift kicking in today expected to cost Canada $262M over a decade https://t.co/yKcn05822l,Twitter Web Client,12/3/16 1:11
804854349260267000,Congratulations to Canada &amp; it's PM for having an open door policy to immigration. They are now a beacon to inclusi‰Û_ https://t.co/b68kMzkvmu,Twitter for iPhone,12/3/16 1:06
804854275407052000,@tshizimba talks about issues immigrants face in QuÌ©bec. # immigration #Canada https://t.co/m0hYomIGi9,Twitter for Android,12/3/16 1:06
804853883935846000,Mexican visa lift expected to cost Canada $262M over a decade https://t.co/eAzrPoz70t by #Outofnames via @c0nvey,Put your button on any page! ,12/3/16 1:04
804852281766199000,"D'aprÌ¬s les critÌ¬res de Canada Immigration, Justin Trudeau serait pas prioritaire pour immigrer au Canada esti",Twitter for iPad,12/3/16 0:58
804849264274919000,"Canada's immigration ""express entry"" - allows economic immigrants to jump the cue. ""System purposely [not does] apply to 1st in line"" Whoa.",Mobile Web (M2),12/3/16 0:46
804848246933880000,"Me: Australia is winning...Canada: hey, I just send you the immigration tip facilities and help Me:.......OH GOD",Twitter for Android,12/3/16 0:42
804846921756114000,@shcorneius https://t.co/cJjRw7Zffq,Twitter for iPhone,12/3/16 0:37
804846624807731000,Hundreds in danger of losing citizenship https://t.co/oqPvxc4RmB,Buffer,12/3/16 0:36
804842587219595000,"‹âÇ‹Ä_‹ÄÛ‹Å¨‹ÄÒ‹â_Œè_Œ_Ñ‹ÅÇ‹ÅÜ‹ÅÜ‹âÜè_ÈçÓ¬‹ÅÎ_Ç÷‹Åè‹Å_Œ_¡‹Å£‹Å_‹Åã‹Å_‹Å_‹âÒ‹ÅÜ•_Ù‹Ä_‹Ä_‹ÄÔ‹â_‹âÇ‹Ä_‹ÄÛ•_öYuPass Canada Immigration Inc. •_ä‹Å_‹Åø‹ÛÅ‹â_‹â_‹Äö‹âÕ__Ô‹Åö‹ÅÙè_¢‹ÅãçÓ_èÇÜ_____¥‹âÕ_èê_Áö•_Åhttps://t.co/yF1nHPTHfk https://t.co/Ae4S6mZU8O",TweetDeck,12/3/16 0:20
804841890629586000,@OneTuffLadyCO just search canada immigration. will end with .ca Then begin the process.,Twitter Web Client,12/3/16 0:17
804836711398260000,"Hundreds may lose their Canadian citizenship or residency because of one corrupt immigration consultant: @dougquan https://t.co/AtjbBYpyMC",TweetDeck,12/2/16 23:56
804832416007356000,"Hundreds may lose Canadian citizenship, resident status because of one corrupt immigration consultant https://t.co/ZOiKnFj8Tj",Hootsuite,12/2/16 23:39
804830096922005000,"Well, that plus fact they hired him. This happens when you commodify immigration status. Here's what I wrote 1yr ag‰Û_ https://t.co/zIdcQucgut",Twitter for iPhone,12/2/16 23:30
804830025736273000,"""Merciful"" immigration policy should be applied to refugees - not billionaires who don't contribute to Canada. https://t.co/9xP43ORIPC",Twitter for iPhone,12/2/16 23:30
804828838811287000,"Recent immigrant to Manitoba says $500 fee is a 'head tax'https://t.co/6y3laZ54l9",Twitter for Android,12/2/16 23:25
804822618985611000,"Immigration changes will help business reach outside Canada.https://t.co/S2Jsq4wS9c#NewCdns #newtocanada #cdnimm",Hootsuite,12/2/16 23:00
804820693535821000,Is the new Manitoba immigration fee a head tax? https://t.co/cX9v1q77HY,Buffer,12/2/16 22:53
