id,text,source,created_at
804819436477747000,"The day after President George W. Bush was reelected, Canada's main immigration website had 115,000 vi https://t.co/nPoppDxain",Twitter for Android,12/2/16 22:48
804815334775648000,Recent immigrant to Manitoba says $500 fee is a 'head tax' https://t.co/vexV0WFB0y,Twitter Web Client,12/2/16 22:31
804810387346653000,"Canada must stop Asian immigration. They are slowly taking over every large city. They have wrecked the BC housing market, #cdnpoli",Twitter Web Client,12/2/16 22:12
804809872386752000,https://t.co/UaB7fJ0O5H What is Canada‰Ûªs Global Skills Strategy all about? Read on ! #Immigration #Newcomers #MCIS,Hootsuite,12/2/16 22:10
804807905174228000,"@monica_barona @rbignell1 what mass Muslim migration is happening in Canada? Total Muslim immigration here is &lt;10%/yr. ~30,000 people.",Twitter for iPhone,12/2/16 22:02
804807646234681000,Labour crisis in Canada‰Ûªs agricultural sector: new study calls for more robust migrant farm worker program #cdnimm https://t.co/lcHITVpnhb,Hootsuite,12/2/16 22:01
804797976304635000,@JaredWyand @lizettemedina_ @tattedfor We suffer the same issue with immigration up here in Canada. This is what happens when your govt,Twitter for Android,12/2/16 21:22
804796575440637000,@TheEconomist profiles Canada's open immigration policies &amp; how they contribute to our economic success:‰Û_ https://t.co/YG5VuV3bgI,PostBeyond,12/2/16 21:17
804795505826033000,"Canada plans to build a wall as well.https://t.co/ktlnLqrYtt",Twitter Web Client,12/2/16 21:12
804794827166523000,@realmommagump Not sure.  I hear CANADA has very STRICT immigration rules and a rigidly enforced border.  Mexico is‰Û_ https://t.co/0z9eOiTzbE,Twitter Web Client,12/2/16 21:10
804794464837529000,"Ma v. Canada (Citizenship and Immigration), 2016 FC 1245 (CanLII) https://t.co/JMDMWovL5y #CourfÌ©dÌ©rale #justice",IFTTT,12/2/16 21:08
804794160133894000,"@vincedemello Last month I was in Canada 23% of the population is foreign born, MPs voted 313-0 to take more refugees &amp; increase immigration",Tweetbot for iëÙS,12/2/16 21:07
804792765544624000,"The Easiest way to Migrate to Canada, Revealed! https://t.co/J97VI2hPcF",Spokal,12/2/16 21:02
804792526079229000,Learn about Polish immigration to Canada w/ this hands-on program @GaltMuseum. #YQL https://t.co/5wixLf8h7E,Hootsuite,12/2/16 21:01
804790909309190000,Immigration Canada servers crashed on US election night. Now Parks Canada's servers crashed unable to handle the 2017 Park Pass offer. LAME,Twitter Web Client,12/2/16 20:54
804790901776285000,"Very interesting points made on ""Strengthening Canada's Competitiveness through Immigration"".",Twitter for BlackBerry,12/2/16 20:54
804790843106361000,", resident status because of one corrupt immigration consultant https://t.co/dfm8kvvI41 via @nationalpost",Twitter Web Client,12/2/16 20:54
804790502461763000,"Hundreds may lose citizenship, resident status because of one corrupt BC... https://t.co/M2SIXTnnph by #nationalpost via @c0nvey",Put your button on any page! ,12/2/16 20:53
804789301972082000,GJC@globeandmail @jeffreybgray WELL MAYBE CANADA SHOULD DO SOMETHING ABOUT IMMIGRATION. MANY RICH IMMIGRANTS COMING TO CANADA NEVER PAID,Twitter Web Client,12/2/16 20:48
804788378734653000,"No matter how rich we are, #Canada cannot afford to waste the skills of any of our residents. #P2PConference #Immigration",Twitter for Android,12/2/16 20:44
804787225154224000,New immigration rules so #Americans can #work in #Canada. #recruitment @globalnews https://t.co/xYsCJ2jaQ1,TweetDeck,12/2/16 20:40
804787222729793000,New immigration rules so #Americans can #work in #Canada. #recruitment @globalnews https://t.co/4eEx1QAjyE,TweetDeck,12/2/16 20:40
804784752305782000,What Wikipedia can‰Ûªt tell you about studying in Canada ? https://t.co/edQYf2mwiZ https://t.co/S1mY1tuSLg,Spokal,12/2/16 20:30
804783967752753000,Resign? - deport her she lied on her immigration documents - what an insult to Canada https://t.co/duwzK9Fbb5,Twitter for iPad,12/2/16 20:27
804783612902207000,"Hundreds may lose Canadian citizenship,resident status because of 1 corrupt immigration consultant https://t.co/xPmPPEoqQM via @nationalpost",Twitter Web Client,12/2/16 20:25
804778988174536000,Dear P.M. @JustinTrudeau - Saw the YT videos saying Americans are welcome in Canada. Immigration policy says abled‰Û_ https://t.co/t1s1Qumi3Y,Twitter Web Client,12/2/16 20:07
804778637132083000,Then again its gonna be a dead language outside of canada soon anyway what with the immigration issues.,Twitter for Android,12/2/16 20:05
804778258843795000,"I'm a certified U.S. educator, B.S. &amp; M.A. degrees. Frmr journo. Want to emigrate to Canada; immigration policy only sees my disability.",Twitter Web Client,12/2/16 20:04
804777626254659000,.@telfordk I wish our country was so welcoming but I am fully aware that it is not. https://t.co/Z72ywwPLeC,Twitter Web Client,12/2/16 20:01
804775916144562000,"Tout se qui est pas bon avec des exemples venant d'autres pays, Trudeau l'inconscient, emmÌ¬ne Ì_a au Canada https://t.co/gzoI4unitC",Twitter for Android,12/2/16 19:55
804772194886631000,https://t.co/VfnpVjSt49 - Canada Posts Perfect Tweet After Immigration Website Crashes - https://t.co/lwW4BnS46u https://t.co/gED4DrnSi7,NerdBits.com,12/2/16 19:40
804771712181170000,Los #mexicanos pueden entrar en #Canada sin #visa pero con un #AVE #immigration https://t.co/2yckxE5x79,Twitter Web Client,12/2/16 19:38
804771381342703000,"Hundreds may lose Canadian citizenship, resident status because of one corrupt immigration consultant https://t.co/4DH0uGrv5E",Facebook,12/2/16 19:37
804769537711185000,"Canada Should do this too , Fact ; Manny of The IMMIGRANTS The Government of Canada Immigration Dept  let in Are Cr‰Û_ https://t.co/agjbfy2sSX",Twitter Web Client,12/2/16 19:29
804764469402411000,Lmao @Canada give him immigration already FFS https://t.co/60gvxHjUlS,Twitter for iPhone,12/2/16 19:09
804761529312681000,READERS ARE Leaders! https://t.co/AOmbtoYB8K,Twitter Web Client,12/2/16 18:57
804761317886361000,"In Canada, there are approx 500,000 ppl in Ontario who are denied healthcare due to immigration status https://t.co/TKQsaosnUf #ohipforall",Twitter for iPhone,12/2/16 18:57
804760358275661000,Canada Posts Strongest Quarterly Growth in Two Years https://t.co/UdTQQ89XiX #canada https://t.co/aCbizkIsgj,Hootsuite,12/2/16 18:53
804758705627508000,IRCC Canada made key changes to their Express Entry Immigration program. to read more https://t.co/unPVKocUFu‰Û_ https://t.co/9RHIbpMSUP,Twitter Web Client,12/2/16 18:46
804756056123568000,Labour crisis looms in Canada‰Ûªs agricultural sector | Toronto Star https://t.co/O2UU7EJ1JM,Facebook,12/2/16 18:36
804755264737943000,"Hundreds may lose citizenship, resident status because of one deceitful immigration consultant https://t.co/QyWBSqkUPt via @nationalpost",Adobeå¨ Social,12/2/16 18:33
804755264737943000,"Hundreds may lose citizenship, resident status because of one deceitful immigration consultant https://t.co/QyWBSqkUPt via @nationalpost",Adobeå¨ Social,12/2/16 18:33
804753663843598000,Canada Investor Immigration Program Business Migration for residence and Citizenship PinoyCare Visa Center is‰Û_ https://t.co/U53YqzGXJ5,WordPress.com,12/2/16 18:26
804753310750244000,Have immigration-related questions you'd like to see in our next blog post? Email contact@canadianimmigration.com #canada #cdnimm,Hootsuite,12/2/16 18:25
804748521463226000,Join the conversation about #immigration to #Canada on our Linkedin page: https://t.co/6OsOJd7hrJ https://t.co/Y06bnqZwvs,Hootsuite,12/2/16 18:06
804747515971014000,#EthicalConsulting #Canada #Citizenship #Immigration... https://t.co/fuaPKER4Hl,Facebook,12/2/16 18:02
804746745808683000,Labour crisis looms in Canada‰Ûªs agricultural sector https://t.co/e3YPPyc0AL via @torontostar,Twitter Web Client,12/2/16 17:59
804746258200035000,"Hundreds may lose Canadian citizenship, resident status because of one corrupt immigration consultant https://t.co/I3MmZK0Mkr #canada",Hootsuite,12/2/16 17:57
804746083532414000,"$500 fee hike for immigrants called cash grab, head tax https://t.co/TM17fSZYaz #canada",Hootsuite,12/2/16 17:56
804744237183025000,"Hundreds may lose Canadian citizenship, resident status because of one corrupt #immigration consultant: https://t.co/v74fX51gBL by @dougquan",Twitter Web Client,12/2/16 17:49
804742529329627000,@England your nation mate @Canada has a immigration scheme that grants foreign excellence employment to better thei‰Û_ https://t.co/EJ51kZ3Eua,Twitter for iPhone,12/2/16 17:42
804742389768273000,"@CassieLeuffen @MarketWatch Canada's immigration website crashed NO ONE left! Disappointed Some illegal immigrants left,are Canada's problem",Twitter for iPad,12/2/16 17:41
804741392962461000,"Hundreds may lose Canadian citizenship, resident status because of one corrupt immigration consultanthttps://t.co/DPec0ThtrD  #cdnpoli",TweetDeck,12/2/16 17:37
804740971917443000,"Hundreds may lose Canadian citizenship, resident status because of one corrupt immigration consultant. https://t.co/AIZ24OV1Si",Hootsuite,12/2/16 17:36
804739667082018000,.@DanaLynnWagner: Should Canada resettle #refugees from Greece? : https://t.co/ChtdO354qo via @IRPP #cdnimm #cdnpoli #immigration,Hootsuite,12/2/16 17:31
804739043875553000,"Cerisier c. Canada (CitoyennetÌ© et Immigration), 2016 CF 1315 (CanLII) https://t.co/Ryqd0JmjRC #CourfÌ©dÌ©rale #justice",IFTTT,12/2/16 17:28
804739042160078000,"Canada (Citizenship and Immigration) v. Menezes, 2016 FC 1301 (CanLII) https://t.co/rHdPBX6sEA #CourfÌ©dÌ©rale #justice",IFTTT,12/2/16 17:28
804734635431313000,Canada Immigration News - Rural Areas and Small Cities Across Canada Eager to Attract More Newc...‰Û_ https://t.co/96FvbS60Aq,Buffer,12/2/16 17:11
804732313456279000,"Chris Alexander announces Tory leadership bid, wants #Canada to boost #immigration to 400,000 a year. #cdnpoli https://t.co/6utuijwG1g",Hootsuite,12/2/16 17:01
804731659446874000,"With Trump threatening to rip up NAFTA, #Canada opens its doors to Mexicans  https://t.co/9cPk29RSwW #Mexico  #immigration @josh_wingrove",Twitter Web Client,12/2/16 16:59
804730646136520000,"Ville de Laval: Coordonnateur(trice) - immigration (Laval, QuÌ©bec, Ca... https://t.co/rfBlWahHZX",Job listings Canada,12/2/16 16:55
804730495661731000,@reason @brianmdoherty #askalibertarian Can one still be a libertarian if he prefers smart immigration (Canada/Australia) over open borders?,Twitter for iPhone,12/2/16 16:54
804730033285791000,"@NewDay A secure border that compliments proper immigration policies IAW our laws is ""bigotry,"" eh? Try this open borders crap in Canada.",Twitter Web Client,12/2/16 16:52
804729431205900000,"Hate group ""Immigration Watch Canada"" are the racist shitbags behind anti-Chinese flyers in Richmond BC: https://t.co/BLE5hl7aDe",Twitter Web Client,12/2/16 16:50
804725639358062000,Will new immigration policies in the US translate into good news for Canada's tech sector? https://t.co/jxZPsyRChE,Hootsuite,12/2/16 16:35
804725020194967000,Your clear path to immigrating  to Canada starts with qualified immigration lawyer who can assess your unique needs‰Û_ https://t.co/ZVROJwj2wc,Post Planner Inc.,12/2/16 16:32
804722049717534000,@DeerOnDrug No. They're actually looser. https://t.co/Y4q2UCER9M,Twitter for Android,12/2/16 16:21
804721136940568000,"Hundreds may lose Canadian citizenship, resident status because of one corrupt immigration consultant https://t.co/euUwOoNggA #canada",IFTTT,12/2/16 16:17
804720563197476000,"Just heard someone pronounce ""croissant"" like ""Croy-Sant"" and I am filing my immigration forms to Canada",Twitter for iPhone,12/2/16 16:15
804720201375842000,Why is it expensive for private candidates? I was compelled to write it by Canada immigration and paid something li‰Û_ https://t.co/AxC1gRZaKz,Twitter for iPhone,12/2/16 16:13
804717344559771000,"Hundreds may lose Canadian citizenship, resident status because of one corrupt immigration consultant | NP https://t.co/B409kJU6OK",__¬åáç_èŒ¨¢_Ñ¬,12/2/16 16:02
804717263408353000,Mexican visa lift expected to cost Canada $262M over a decade https://t.co/M98VqOKtgS #cdnpoli #cdnimm,TweetDeck,12/2/16 16:02
804716507796295000,@SomersetBaller @Canuckle_head @K69atie The US NZ Oz and Canada CANT limit immigration. But Europe can and should,Twitter for iPhone,12/2/16 15:59
804716056363184000,"How To Join Canadian Universities?https://t.co/qSMkC0LVTn https://t.co/Ojrrou16Pc",Twitter Web Client,12/2/16 15:57
804714965420609000,That Sunny Wang's former clients may now be deported is a reminder to retain only honest &amp; reputable counsel #cdnimm https://t.co/BMJHR9xHWY,Hootsuite,12/2/16 15:52
804714965169008000,That Sunny Wang's former clients may now be deported is a reminder to retain only honest &amp; reputable counsel #cdnimm https://t.co/nYjEqBgf2V,Hootsuite,12/2/16 15:52
804714679306190000,Have you seen #Canada's immigration plan for 2017? The details are right here: https://t.co/lUI4bk4cIB #cdnimm https://t.co/PofGN9Ldcq,Twitter Web Client,12/2/16 15:51
804713859638587000,"Start You Study Application To Canada:https://t.co/qSMkC0ul1P https://t.co/4jhENbUppP",Twitter Web Client,12/2/16 15:48
804713799462907000,Immigration francophone en Nouvelle-Ìäcosse @VivreEnAcadie  https://t.co/e73EqZp2bS https://t.co/MR6Ms35MPj,Twitter Web Client,12/2/16 15:48
804713278945558000,@Almost40Jc #canada ENFORCES their immigration laws. They found out they can't just pick up and move there! _Ù÷â_Ù÷â_Ù÷â_Ù÷â‰Û_ https://t.co/DPM9Of1AdF,Twitter for iPhone,12/2/16 15:46
804712649812537000,"Andrade c. Canada (CitoyennetÌ© et Immigration), 2011 CF 842 (CanLII) https://t.co/TEgUEGd9id #CourfÌ©dÌ©rale #justice",IFTTT,12/2/16 15:43
804712646373179000,"Gonzalez c. Canada (Commission de l'emploi et de l'immigration), [1997] 3 RCF 646, 1997 CanLII 6087 (CF) https://t.co/chnnP98zxW #CourfÌ©dÌ©‰Û_",IFTTT,12/2/16 15:43
804712350125264000,"Prepare To Study In Canada:https://t.co/qSMkC0ul1P https://t.co/cVDVh1UiEw",Twitter Web Client,12/2/16 15:42
804712120382357000,"ôÉôâ¯_¯á¯_¯© ôÄô_¯¬ôÄ ¯_ôãôÄô ¯øô_¯© ¯»ôÅ¯»¯_ ¯¬¯_¯¬ ¯_ôãôà¯Â¯±¯© ôãôÛ 5000 ¯«¯¨¯µ .. ôâ¯øôÉ ¯áôã¯¬ôÄ ¯_ôã¯¢ô  !................................¯«¯_¯±ôÄ ¯_ôãôÉô ¯«ôö¯±... https://t.co/JCspmEUlxI",Facebook,12/2/16 15:41
804711692688994000,Held at Canadian immigration. No idea why. Missed connecting flight. Very unfriendly welcome to #Canada,Twitter for iPhone,12/2/16 15:39
804710734190039000,@moniqueb54 https://t.co/V3nY8CbFZG  Ì_a te convient la fÌ©dÌ©raliste,Twitter Web Client,12/2/16 15:36
804710584369324000,"Hundreds may lose citizenship, resident status because of one corrupt BC immigration consultant https://t.co/Idd1WHnN7F via @nationalpost",Twitter Web Client,12/2/16 15:35
804708703408558000,"Today the #Canadian government has lifted visa requirements on Mexico, but it might cost a lot. #cdnpoli https://t.co/20UVwGFB5y",Sprout Social,12/2/16 15:28
804708627823165000,Labour crisis looms in Canada‰Ûªs agricultural sector https://t.co/BwbyzUxbMv via @torontostar,Twitter Web Client,12/2/16 15:27
804703066343649000,Recent immigrant to Manitoba says $500 fee is a 'head tax' https://t.co/vz9OnAQCdo,Twitter Web Client,12/2/16 15:05
804701751961993000,"https://t.co/VfnpVjSt49 - Canada's Immigration Site Crashes, and Twitter Erupts in Confusion and Outrage -‰Û_ https://t.co/z7Pwvgx47q",NerdBits.com,12/2/16 15:00
804701157448765000,Mexican visa lift kicking in today expected to cost Canada $262M over a decade https://t.co/EZP5wnUvAA,Twitter Web Client,12/2/16 14:58
804699949803962000,"Hundreds may lose Canadian citizenship, resident status because of one deceitful immigration consultant https://t.co/yNHHwWtI0O",IFTTT,12/2/16 14:53
804699612338655000,Labour crisis looms in Canada‰Ûªs agricultural sector #cdnimm https://t.co/IwUJE8rAy2 via @torontostar,Twitter Web Client,12/2/16 14:51
804699444910243000,"PM's Mexican visa lift to flood Canada with bogus refugee claims, $433.5M over a decadehttps://t.co/YfYlSewbqL https://t.co/gepQ9wKmFZ",iOS,12/2/16 14:51
804695924845006000,"Ìävaluer vos chances pour l'immigration au Canada...#Quebec #Canada #Immigrationhttps://t.co/gM8mAeiD9V",Twitter Web Client,12/2/16 14:37
804695678299541000,"Check out our latest case study about our work for Immigration, Refugees and Citizenship Canada: https://t.co/Ku1jjPZ0UJ",Twitter Web Client,12/2/16 14:36
804694240093556000,Recent immigrant to Manitoba says $500 fee is a 'head tax' https://t.co/RMuOyHVhZ9,Twitter for iPhone,12/2/16 14:30
804693777877233000,Recent immigrant to Manitoba says $500 fee is a 'head tax' https://t.co/v0O7EaKeRK,Twitter Web Client,12/2/16 14:28
804693737980960000,Recent immigrant to Manitoba says $500 fee is a 'head tax' https://t.co/2POwv5NFyj,Twitter Web Client,12/2/16 14:28
804692031075446000,"@Proud2Progress Don't like it Canada is north. Mexicant wont let you in, their immigration laws are crazy",Twitter Web Client,12/2/16 14:21
804691089248677000,Canada is bracing for a surge of Mexican immigrants after Trump‰Ûªs win ‰ÛÓ via @guardian https://t.co/z85IPnfjaK via @bi_contributors,Twitter Web Client,12/2/16 14:18
804689480053616000,La complexitÌ© a toujours Ì©tÌ© un Ì©lÌ©ment positif de l'histoire de l'immigration au Canada #johnralstonsaul #philosophie #edgarmorin #p2p,Twitter for iPhone,12/2/16 14:11
804688682557046000,Thx 4 your illuminating presentation @JohnRalstonSaul and 4 articulating Canada's immigration philosophy. It's kind. #p2pconference,Mobile Web (M5),12/2/16 14:08
804687790864736000,"@real_jonstewart @MOARChuck @Pilot9 If only Canada didn't have such strict immigration policies, some of these liberals would have left.",Twitter Web Client,12/2/16 14:04
804686966977654000,Immigration Developments From The Fall Economic Statement #cdnimm https://t.co/RnJt9GEHZ7,Hootsuite,12/2/16 14:01
804686936849993000,Conference Board of Canada says the country is facing an agriculture labour crisis &amp; will need more migrant workers: https://t.co/aNkBUCajf5,Twitter Web Client,12/2/16 14:01
804686842276835000,Cuban National Who Visited Canada Can‰Ûªt Duck Re-Entry Bar https://t.co/K1PlVW58Q9,LinkedIn,12/2/16 14:01
804684712547676000,@NeilJEdmondson @Garacaius Monsef has 'slipped through' 3 immigration vettings presumably-- 1)entry Canada 2)MP 3)Minister of the Crown HOW?,Twitter for iPhone,12/2/16 13:52
804684529919262000,"Rencontre avec Ada Elvi Ruiz &amp; Claudine Tesire de Immigration francophone en Nouvelle-Ìäcosse s'expatrier au Canada?https://t.co/hju9PN8hcT",Twitter Web Client,12/2/16 13:51
804684000115720000,Rencontre avec Ada Elvi Ruiz  et Claudine Tesire de Immigration francophone en Nouvelle-Ìäcosse s'expatrier au Canada?https://t.co/tV8De9UL8U,Twitter Web Client,12/2/16 13:49
804683600721571000,https://t.co/8ImlSl5OnH - Vous rÌ»vez de vous expatrier au Canada ? https://t.co/QOUa7dAnng via @lepetitjournal,Twitter Web Client,12/2/16 13:48
804682867901132000,#Canada dubbed ‰ÛÏlast liberals‰Ûù standing by #Economist. Are we one of the few countries where immigration is still w‰Û_ https://t.co/72efMFHvXh,Hootsuite,12/2/16 13:45
804682520793120000,"John Ralston Saul: ""the word immigrant is noble...Canada is built on immigration"" #P2PConference https://t.co/oPrfdp0hbD",Twitter for Android,12/2/16 13:43
804682201501667000,Day 2 of #p2pconference Keynote Speaker talking about Immigration and Citizenship in #Canada https://t.co/PEErhmpm86,Twitter for iPhone,12/2/16 13:42
804680024947359000,Labour crisis looms in Canada‰Ûªs agricultural sector | Consider this in context of Fraser v Ontario https://t.co/FNSZgHvaxt,LinkedIn,12/2/16 13:34
804679662362382000,"""In Canada, 'migrant' has no dignified meaning. Immigrant is Canada's most noble term, a country built on #immigration"" - JRS #P2PConference",Twitter for Android,12/2/16 13:32
804679627889397000,"Working Holiday Visa Canada - Holiday, Study &amp; Get Paid https://t.co/wvg9T360Uk https://t.co/EThlpQjIFW",Spokal,12/2/16 13:32
804679308505587000,Canada: Fragomen Immigration Update: November 22 - December 1 https://t.co/OxrqmHlVtF,Fragomen production,12/2/16 13:31
804679152821563000,Du nouveau : niveau 2 en transport et en immigration des gens d'affaires dans le rÌ©pertoire @theLegal500 Canada https://t.co/K8aXl43iwV,Hootsuite,12/2/16 13:30
804679152779624000,Transport &amp; Business Immigration practices newly ranked as Band 2 in @theLegal500 Canada guide https://t.co/j4xfnbb4sr,Hootsuite,12/2/16 13:30
804676943362793000,Le #Canada lÌ¬ve l'obligation de visa pour les Mexicains https://t.co/6Z1OpVZIN4 #polcan #Mexique #Immigration,Twitter for iPhone,12/2/16 13:21
804676053495087000,"Canada is bracing for a surge of Mexican immigrants after Trump's win https://t.co/ZJF7LqC54S https://t.co/RouxpY2Ok7",Twitter for iPad,12/2/16 13:18
804675644944764000,https://t.co/XFu0iNXu65. Pour la madame qui ne croit pas que 300 milles ...etc,Put your button on any page! ,12/2/16 13:16
804675337732886000,"Go North, Young Coder: How Canada's Tech Scene May Benefit From Trump's Election https://t.co/Zu9QpLvBoI‰Û_ https://t.co/5eOhru9rJZ",Hootsuite,12/2/16 13:15
804672095347245000,Labour crisis looms in Canada‰Ûªs agricultural sector https://t.co/n1bFdw3vuy via @torontostar,Twitter Web Client,12/2/16 13:02
804671964233207000,Mexican visa lift expected to cost Canada $262M over a decade https://t.co/M98VqOsSpk #cdnpoli #cdnimm,TweetDeck,12/2/16 13:02
804670652573745000,Express Entry Canada - A New Life awaits https://t.co/HkmsOb9iDt https://t.co/zf7GmOKhRh,Spokal,12/2/16 12:56
804669988279844000,Mexican visa lift kicking in today expected to cost Canada $262M over a decade https://t.co/GcMibJFqjo,Facebook,12/2/16 12:54
804669985562001000,https://t.co/QYl3NJaEVI,IFTTT,12/2/16 12:54
804666150462300000,#Labour #crisis looms in #Canada‰Ûªs #agricultural sector https://t.co/5twQt3qmnb,Twitter for iPhone,12/2/16 12:38
804664578407796000,Webinar: Understanding Canada's immigration programs on Monday Dec 5th 2016 https://t.co/NBKaF9y7c7. To register‰Û_ https://t.co/BbKpNUR38P,Hootsuite,12/2/16 12:32
804663381085011000,"Seriously? Minister said that?She lied on immigration application. Continues to lie- Now undermines all of Canada. https://t.co/JqCQpkhNsL",Twitter for iPad,12/2/16 12:27
804663275329875000,Points per Factor Express Entry Points Summary https://t.co/FFW4Kx4711 https://t.co/a76BOMxB6I,Spokal,12/2/16 12:27
804658726439239000,Immigration to Canada  https://t.co/x4yKGkCfZo via @getsocial_io,Twitter Web Client,12/2/16 12:09
804652414003396000,#Immigration #Canada #PRVisa #Services In #Delhi Visit Here... https://t.co/kWI2JmO5VZ https://t.co/jR94jl6JSV,Twitter Web Client,12/2/16 11:44
804648665788911000,https://t.co/vQZdCObMG6 https://t.co/T4VwfzSx7q,Plurk,12/2/16 11:29
804648143887462000,https://t.co/6T4h5BGrsM https://t.co/IVT4ll1Bo0,Plurk,12/2/16 11:27
804645330969067000,"Thanks to Turdo, Trump no longer needs wall between Mexicohttps://t.co/n1vJgjEf6F",Twitter for Android,12/2/16 11:16
804645217303412000,The Canada immigration consultant in Hyderabad will process everything faster! https://t.co/YMu2pc6GfS #Kansasoverseascareers,Twitter Web Client,12/2/16 11:15
804631749804380000,Canada Immigration Seminar by Rhonda WilliamsåÊRCIC https://t.co/0ZJ046B5ZG https://t.co/GjGddTTr8R,WordPress.com,12/2/16 10:22
804631749804380000,Canada Immigration Seminar by Rhonda WilliamsåÊRCIC https://t.co/0ZJ046B5ZG https://t.co/GjGddTTr8R,WordPress.com,12/2/16 10:22
804628183601528000,#Immigration au #Canada : prochaines sessions informations @DestCan  https://t.co/NcYzSiF46y https://t.co/GCnqZc9eAg,HubSpot,12/2/16 10:08
804626675501768000,"@can_immigrant Hello! I have my bachelor; I would like to make my life in CANADA.I need your help for my immigration.All the best to you",Twitter Web Client,12/2/16 10:02
804611992816390000,Labour crisis looms in Canada‰Ûªs agricultural sector - Toronto Star https://t.co/ub6YE9MoYk,Hootsuite,12/2/16 9:03
804605273130278000,Comprendre les programmes d'immigration le 5 dÌ©cembre ÌÊ 13h (heure de Paris). Inscription: https://t.co/akROAtlJW9 https://t.co/7jCCFKRwai,Hootsuite,12/2/16 8:37
804603418702528000,"""Why do most of the Indians plan their Immigration to Canada?"" https://t.co/ikaatmfTjC on @LinkedIn",Twitter Web Client,12/2/16 8:29
804594100519497000,Canada's Immigration Site Keeps Crashing For Some Reason https://t.co/w5cGJzprWH,Twitter for iPhone,12/2/16 7:52
804592980719898000,Mexican visa lift expected to cost Canada $262M over a decade. #Canada #immigration #Mexico https://t.co/Z3aVH5URkf,Twitter Web Client,12/2/16 7:48
804582277791567000,Mexican visa lift kicking in today expected to cost Canada $262M over a decade https://t.co/IV5DVzBRcG,Facebook,12/2/16 7:05
804580896523321000,#FollowFriday to all our followers. :) #cdnimm #immigration #Canada #Toronto,IFTTT,12/2/16 7:00
804580814663000000,We are helping to people for Canada Immigration. Latest CRS draw on November 30th 2016. The lowest CRS score # 786. https://t.co/7OTqTKCfz0,Twitter Web Client,12/2/16 6:59
804580678067097000,"#Best #Canada #Immigration #Consultant #in #Hyderabadhttps://t.co/lotpUvdS6whttps://t.co/jKUDybw9a8https://t.co/jVKVZmKLXD",Twitter Web Client,12/2/16 6:59
804575912591290000,Mexican visa lift kicking in today expected to cost Canada $262M over a decade https://t.co/pfT8oVmkNU,Twitter Web Client,12/2/16 6:40
